{
  "schema_version": "job-skill-shelver-298-targeted-v4-safety-technical-rereview-result-v1",
  "package_id": "job-skill-shelver-298-targeted-v4-safety-technical-rereview-packet-v1",
  "candidate_set_hash": "sha256:309a399aed46d0a7f5ca257c74a30312bd3a2931f53e5c03422739602c8c0d5a",
  "reviewer": "赫东",
  "submitted_at": "2026-07-20T09:01:55.000Z",
  "summary": {
    "total": 120,
    "pass": 118,
    "return_for_revision": 2
  },
  "questions": [
    {
      "question_id": "M1_DG_028_V4",
      "previous_question_id": "M1_DG_028_V3",
      "new_semantic_hash": "sha256:ee2d6b47c48b749716b10b164e5458d671e39689f68f16251941537ae13f4825",
      "candidate_record_hash": "sha256:ee14b5cffcbfde2346cce9c40ff1eaf4992b6c52de85b120a8bd84ef46399ff9",
      "conclusion": "PASS",
      "review_note": "通过"
    },
    {
      "question_id": "M1_DG_029_V4",
      "previous_question_id": "M1_DG_029_V3",
      "new_semantic_hash": "sha256:0149982f97b7913f630dbf4dd20d45e497e7fe695d30f281374bad45a6d2233b",
      "candidate_record_hash": "sha256:b7284be5cc7d791c787724ca9aec8ecb5b89d3a1bf78b155d9b345a306adcaf4",
      "conclusion": "PASS",
      "review_note": "通过"
    },
    {
      "question_id": "M1_DG_032_V4",
      "previous_question_id": "M1_DG_032_V3",
      "new_semantic_hash": "sha256:5d6e566a02d0ae4e3159d3b84cfbdbc880f3b58c682b59c95bb6b057a03e2f5c",
      "candidate_record_hash": "sha256:9898eb5033f6bb8d48e5d37d86d5f9740e9e7ff7b959292df0691b2dabfba6d1",
      "conclusion": "PASS",
      "review_note": "通过"
    },
    {
      "question_id": "M1_OP_037_V4",
      "previous_question_id": "M1_OP_037_V3",
      "new_semantic_hash": "sha256:89ae022814d0b5e6feeb895e270120756175b75c307616f6f85f913be8712119",
      "candidate_record_hash": "sha256:edd5b458da50cf8becf9d55bf12a9ffd31c3410adbeeb2b96a9040aad780e7e2",
      "conclusion": "RETURN_FOR_REVISION",
      "review_note": "退回复修：工具条件写明5件均为不同SKU/规格，但题干、rubric和2分锚点要求“同一SKU连续成面”。在当前道具集下不存在可形成连续排面的同SKU复数商品，r3无法观察，2分标准不可执行；assessment_point仍为“大小排序实操”，与V4实际考查的排面图/SKU归位不一致。最低可接受修正：至少设置一个SKU包含2件及以上同款商品并锁定唯一排面图，或删除“同一SKU连续成面”指标；同步更新assessment_point、rubric及0/1/2分阈值，确保每项指标均可由现场道具观察和唯一判定。"
    },
    {
      "question_id": "M1_OP_038_V4",
      "previous_question_id": "M1_OP_038_V3",
      "new_semantic_hash": "sha256:6ad4488d8d8363cca02f4160ca46f43cfb6f91552b59373465eb731c67ebcc3c",
      "candidate_record_hash": "sha256:30565f78e4e85042d9910c4e7eff3653198702ab04cd0c3b95c392a0021ce2d8",
      "conclusion": "RETURN_FOR_REVISION",
      "review_note": "退回复修：题干定义6个步骤（移货、警示隔离、清洁、干燥、复位、复查），rubric仅列5项并把“确认干燥”和“复位商品”合并，1分锚点却按“6步中的4至5步”计分，评分单位不一致，评估员无法稳定判定4步或5步，且可能漏判未干燥即复位。最低可接受修正：将“确认层板干燥”和“复位商品”拆成两个独立criterion，或统一改成5项流程并重写0/1/2分阈值；明确未隔离湿区或未确认干燥即复位商品均立即停止并判0分。"
    },
    {
      "question_id": "M1_OP_039_V4",
      "previous_question_id": "M1_OP_039_V3",
      "new_semantic_hash": "sha256:cf6e579ec2905fac4dfbf48176ec0dc50ddd5df8f5fa4073bfcb24d54681e2bd",
      "candidate_record_hash": "sha256:00992d0fcceb0b8914c6d3cf4ff79d81930451a9d4edcbda9f2f20ed15fba717",
      "conclusion": "PASS",
      "review_note": "通过"
    },
    {
      "question_id": "M1_OP_040_V4",
      "previous_question_id": "M1_OP_040_V3",
      "new_semantic_hash": "sha256:70fb682cc69307366c311d03c2f10d19414526d56467ec7936952932c8bb230c",
      "candidate_record_hash": "sha256:f0216ebbad26756a74cba586fb7f9d4e203808a81b2e1b4c398c5c3da96cf24a",
      "conclusion": "PASS",
      "review_note": "通过"
    },
    {
      "question_id": "M1_OP_041_V4",
      "previous_question_id": "M1_OP_041_V3",
      "new_semantic_hash": "sha256:cfb15eb0282b175050b71863eb5c7f3255318418e47c4226046004e810770f6d",
      "candidate_record_hash": "sha256:33952866b0eaca88273e17f9fb4ef24376fcb8f7aaf4aba594b610c6dedbac37",
      "conclusion": "PASS",
      "review_note": "通过"
    },
    {
      "question_id": "M1_OP_044_V4",
      "previous_question_id": "M1_OP_044_V3",
      "new_semantic_hash": "sha256:460689fb673ccbb0c99e03d082cd2c05ffc70e6683c72a6dd15f5d6e80844ddb",
      "candidate_record_hash": "sha256:43c04de22f7938393e6baaa41e061623d3c3ae307328788e66524efeeca21abc",
      "conclusion": "PASS",
      "review_note": "通过"
    },
    {
      "question_id": "M1_OP_046_V4",
      "previous_question_id": "M1_OP_046_V3",
      "new_semantic_hash": "sha256:ba2ed38b0c5777284ab7bf9b60c0eaed54bfb58d027fa4aa46fbeac47441c0df",
      "candidate_record_hash": "sha256:dcd55c83ce69c72d17f0356a1c5108f8f8d1cb944df07cad1066e50308014767",
      "conclusion": "PASS",
      "review_note": "通过"
    },
    {
      "question_id": "M1_OP_047_V4",
      "previous_question_id": "M1_OP_047_V3",
      "new_semantic_hash": "sha256:71ae520691e479d7433bee6db126cfcaa532fca3db9c8f06ca1c84d3481eb119",
      "candidate_record_hash": "sha256:0dbec97029108762af3cbe1789563310e3f494c8776fecb86a709465129639b9",
      "conclusion": "PASS",
      "review_note": "通过"
    },
    {
      "question_id": "M1_SC_005_V4",
      "previous_question_id": "M1_SC_005_V3",
      "new_semantic_hash": "sha256:d45f7229ce6385d8ad4f397fdde0f57d38b9434349a28e7a6739da9977668db6",
      "candidate_record_hash": "sha256:4be6d8d02b82ba1198f6afbbfd23a5fdde2cfb205724c895baa10735c2151567",
      "conclusion": "PASS",
      "review_note": "通过"
    },
    {
      "question_id": "M1_SC_012_V4",
      "previous_question_id": "M1_SC_012_V3",
      "new_semantic_hash": "sha256:467d8f3884c21f1c5f033e3b99b3111b2f6407ce057d6ffac3aafda0c9ddfc8e",
      "candidate_record_hash": "sha256:c460537c62fc32ae9b2a80fcffc32d4e247d0b60461aa9959a335819e33b93cc",
      "conclusion": "PASS",
      "review_note": "通过"
    },
    {
      "question_id": "M1_TF_025_V4",
      "previous_question_id": "M1_TF_025_V3",
      "new_semantic_hash": "sha256:e1b4aad970878ba021cdfbfa7cb810710866fbcbcf8df36bae12d54cd14c426b",
      "candidate_record_hash": "sha256:cbd29eaac0ed163e690846c49f90c2516c1a2b1f48464921db4ce7cd012ce859",
      "conclusion": "PASS",
      "review_note": "通过"
    },
    {
      "question_id": "M2_DG_026_V4",
      "previous_question_id": "M2_DG_026_V3",
      "new_semantic_hash": "sha256:d44aaee2178589cd9584f41d3d1abae1048cfc23f61c2d833da8ae0138a28a37",
      "candidate_record_hash": "sha256:3d9bfab5007dbf03fa9040c4f7c30b14abccc8f536183e73dca0a5b8cda8e924",
      "conclusion": "PASS",
      "review_note": "通过"
    },
    {
      "question_id": "M2_OP_028_V4",
      "previous_question_id": "M2_OP_028_V3",
      "new_semantic_hash": "sha256:ee71ce72f464135214aa02c4c6a30f3cd804ef73bf7d0612738a42c0235c330f",
      "candidate_record_hash": "sha256:d7cd07f83d3f5ee71c8a26075f6ab9404ce40438abc2588d9ee0f90b9ab805cf",
      "conclusion": "PASS",
      "review_note": "通过"
    },
    {
      "question_id": "M2_OP_031_V4",
      "previous_question_id": "M2_OP_031_V3",
      "new_semantic_hash": "sha256:28f1f63e2d651d94b71986a56041586cecc3ed2a7c6ca35d336ab8c4d04f871e",
      "candidate_record_hash": "sha256:3bdcdbdec644b138c6045d563305926529c09500c23a5ba13b4916461f61f12a",
      "conclusion": "PASS",
      "review_note": "通过"
    },
    {
      "question_id": "M2_OP_032_V4",
      "previous_question_id": "M2_OP_032_V3",
      "new_semantic_hash": "sha256:be75881556a4b1c36bbfb00732cdcf785cb3a9ed1aecba3c7eb25bdffbc6fa38",
      "candidate_record_hash": "sha256:e8fb4473204c9f80ebadc25b3a2534c58a2a4a336abce73617c9840bdbbe9f8b",
      "conclusion": "PASS",
      "review_note": "通过"
    },
    {
      "question_id": "M2_OP_033_V4",
      "previous_question_id": "M2_OP_033_V3",
      "new_semantic_hash": "sha256:6248f2ab11609f01676946ca99ff4228d42fd8f1ed4d1a545403e42d6b6d3e55",
      "candidate_record_hash": "sha256:ca0dbd9e2355b84ab84805f078057b9e3789f951f1334d7b2fabe9e18c0942f8",
      "conclusion": "PASS",
      "review_note": "通过"
    },
    {
      "question_id": "M2_OP_034_V4",
      "previous_question_id": "M2_OP_034_V3",
      "new_semantic_hash": "sha256:a4087c4bca7044363a7d65b6d1bb44871cd5afcf4e4aee6c06b58bf1a707cda3",
      "candidate_record_hash": "sha256:75039d04af60dba0183650248ae6ff781a6a2dfdb633b8b78d4c145716ba1387",
      "conclusion": "PASS",
      "review_note": "通过"
    },
    {
      "question_id": "M2_OP_035_V4",
      "previous_question_id": "M2_OP_035_V3",
      "new_semantic_hash": "sha256:400e8b8f639b67698fd534ff24cec79864bf85eb582ada1c48ab4e9553c9cb5f",
      "candidate_record_hash": "sha256:f91a30f44bf1cbc855b1cfc1a515fd8a4502db5233bc4f1406bec6c46275316a",
      "conclusion": "PASS",
      "review_note": "通过"
    },
    {
      "question_id": "M2_OP_037_V4",
      "previous_question_id": "M2_OP_037_V3",
      "new_semantic_hash": "sha256:b8afe642e67997a27e876e09e87e6d6f50c813598c5c371f9e7b6b3a8fb9a33c",
      "candidate_record_hash": "sha256:7bdca07c78f027a89b50dc7ceea05e3d76b231a70bfd877c20bd39d7a5cb222c",
      "conclusion": "PASS",
      "review_note": "通过"
    },
    {
      "question_id": "M2_OP_038_V4",
      "previous_question_id": "M2_OP_038_V3",
      "new_semantic_hash": "sha256:9d6ff5e46b2191a23fe0a40d384204f6602699328a8cd1ad82714debc32ec7cb",
      "candidate_record_hash": "sha256:5b782b84467dbd307a13fab287051253293717a076cc78bc8dc6dcb18315e688",
      "conclusion": "PASS",
      "review_note": "通过"
    },
    {
      "question_id": "M2_OP_039_V4",
      "previous_question_id": "M2_OP_039_V3",
      "new_semantic_hash": "sha256:e1e11e5b946b21a5d9d81376de4692335a700846c88e939b89610398c0dffa93",
      "candidate_record_hash": "sha256:8f6097104357521d42f029e48b1a3424ba20efeb76b78d6732d57f6a47fa0f2f",
      "conclusion": "PASS",
      "review_note": "通过"
    },
    {
      "question_id": "M2_OP_040_V4",
      "previous_question_id": "M2_OP_040_V3",
      "new_semantic_hash": "sha256:73de3aa67b13592741f4edcd84564f48ea2eb9db150bb1da752da9203f1fa70c",
      "candidate_record_hash": "sha256:586b658771d16b1e8ca6064af955fa8eab9a1b1eb547170891efedb6a3460c8d",
      "conclusion": "PASS",
      "review_note": "通过"
    },
    {
      "question_id": "M2_OP_041_V4",
      "previous_question_id": "M2_OP_041_V3",